name,url,description,address,latitude,longitude,start_time,end_time,ticketed_events,fully_booked
Tour the Square Root Factory,https://programme.openhouse.org.uk/listings/11297,,"Unit D11, Leyton Industrial Village, Argall Avenue, E10 7QP",51.57054410000001,-0.0437279,10:30:00,14:30:00,Yes,Yes
Tower Hamlets Town Hall,https://programme.openhouse.org.uk/listings/11725,"Tower Hamlets Town Hall, the new headquarters for the London Borough of Tower Hamlets Council, encompasses the restoration of the Grade II listed former Royal London Hospital building, and the addition of a new build extension.","160 Whitechapel Road, E1 1BJ",51.51878139999999,-0.06012530000000001,10:00:00,16:00:00,No,
Trellick Tower,https://programme.openhouse.org.uk/listings/2203,"Goldfinger's 31-storey social housing tower is one of London's most remarkable high-rises. Monumental, with its free-standing service tower and triumphal boiler house, Trellick retains beautiful detailing and a rich use of materials.","5 Golborne Road, W10 5UT",51.5237086,-0.2053479,13:00:00,14:00:00,Yes,Yes
Trevithick House,https://programme.openhouse.org.uk/listings/8655,"Pre war social housing flats, red brick, Georgian sash windows, playground, allotments and washing lines outside.","14 Trevithick House, York Rise, NW5 1DR",51.558951,-0.1439279,14:00:00,17:00:00,No,
Turf Projects (Whitgift Centre),https://programme.openhouse.org.uk/listings/12004,"Founded in 2013 by Croydon locals, Turf Projects is Croydon’s homegrown artist space and the first entirely artist-run contemporary art space in the borough.","46-47 Trinity Court, Whitgift Centre, Croydon, CR0 1UQ",51.37616,-0.09924,11:00:00,17:00:00,No,
Twickenham Museum,https://programme.openhouse.org.uk/listings/1741,"Grade II listed former waterman's cottage c1720. Restored and converted into a museum celebrating the rich history of Twickenham, Whitton, Teddington and the Hamptons.","25 The Embankment, Twickenham, TW1 3DU",51.4465155,-0.3261184,11:00:00,14:00:00,No,
"Tyrants, Colonialism and Slavery walking tour",https://programme.openhouse.org.uk/listings/11672,"A diverse walking tour, with a qualified guide, in the heart of Westminster where we visit some statues and places that have a significance to tyranny, colonialism and slavery.  The walk is accessible to all and ends in Trafalgar Square.","Parliament Square, SW1A 0AA",51.5010268,-0.1266768,11:00:00,15:00:00,Yes,Yes
UCL PEARL,https://programme.openhouse.org.uk/listings/9542,"UCL PEARL is a brand new building designed to be a laboratory that can ""house the world"" so that we can create different environments from around the world for experiments about people and the environment around them.","UCL PEARL, Yew Tree Avenue, RM10 7FN",51.5475663,0.16966,10:30:00,16:30:00,Yes,Yes
Union Chapel,https://programme.openhouse.org.uk/listings/2230,"A Grade I and II*  treasure that’s home to an inclusive church, an award winning venue, a unique organ and The Margins Project for those in crisis in London. 
Family Organ Building Workshops are generously supported by the Institute of Physics","Compton Terrace, N1 2UN",51.5446871,-0.1028803,10:00:00,14:30:00,Yes,Yes
Valence House,https://programme.openhouse.org.uk/listings/2253,Grade II* listed 15C and later manor house with medieval moat. Recently discovered late 16C wall painting and impressive oak paneling. Evocative museum galleries that bring Barking & Dagenham's past alive.,"Becontree Avenue, Dagenham, RM8 3HT",51.5589773,0.1338659,10:00:00,16:00:00,No,
Vanbrugh Park Estate,https://programme.openhouse.org.uk/listings/10329,"Vanbrugh Park Estate was designed by Chamberlin, Powell and Bon. The estate shares many stylistic similarities with their wider work such as the semi-circular curved motifs, purposeful use of light, and approach to community living.","18 Combe Avenue, Vanbrugh Park Estate, SE3 7PY",51.478469,0.012157,11:00:00,16:00:00,No,
Walking Tour of Wood Green Placemaking Projects,https://programme.openhouse.org.uk/listings/12089,"Haringey Council will guide the public around recently completed placemaking projects around Wood Green town centre, featuring the new Youth Hub, a new Community Cafe in a park and co-designed art murals and pocket parks","Outside Wood Green Underground Station, N22 8HH",51.59743,-0.10977,10:00:00,12:00:00,Yes,Yes
Walking tour: Central Foundation Boys' School,https://programme.openhouse.org.uk/listings/11815,"Over the last 13 years, the 150-year-old school has reused and built upon its existing campus to provide new, state-of-the-art facilities. See how new architecture can sit with heritage buildings to create something completely new.","Central Foundation Boys School, Cowper St, EC2A 4SH",51.5252832,-0.0864693,14:00:00,16:00:00,Yes,Yes
Walthamstow Wetlands,https://programme.openhouse.org.uk/listings/3711,Join us for a tour of the refurbished Marine Engine House with our architects Witherford Watson Mann.,"Marine Engine House, 2 Forest Road, N17 9NH",51.586438,-0.0524322,11:00:00,15:30:00,Yes,Yes
Walworth Garden,https://programme.openhouse.org.uk/listings/10950,"Our timber frame building was designed by Matrix Feminist Design Co-Operative, and built by women. It represents our community's history of activism-the same ethos that transformed our site from dereliction, into a thriving community garden","206 Manor Place, SE17 3BN",51.4871574,-0.1019914,09:00:00,16:00:00,No,
Wandsworth House,https://programme.openhouse.org.uk/listings/9888,"A refurbishment of the loft. Two extra rooms are added accessible from a shared room. A lounge netting hangs in front of the loft spaces. 
A refurbishment of the lower ground floor into a home office with its own entrance.","20 Schubert Road, Putney, SW15 2QS",51.4576393,-0.2045922,10:00:00,17:00:00,No,
West Wickham Library,https://programme.openhouse.org.uk/listings/12207,Art Deco building designed in 1934 by Leslie Kemp and Tasker in International Moderne style. Now the temporary home of West Wickham Library.,"77 Addington Road, West Wickham, BR4 9BG",51.36993,-0.00249,09:30:00,17:00:00,No,
Westbury Estate,https://programme.openhouse.org.uk/listings/8371,Westbury Estate was designed by Philip Bottomley and Colin Lucas in 1961 - 1966 under Ted Hollamby. The resident-led walk will include a discussion about regeneration as well as audio recordings from Philip Bottomley tbc,"Westbury Street, Wandsworth, SW8",51.4755221,-0.1319576,11:00:00,14:00:00,Yes,Yes
Whitehall Historic House,https://programme.openhouse.org.uk/listings/3742,"Originally a farmer's house dating to 1500, with jettied upper storey. Later additions reflect the changing lifestyles of the owners, including the Killicks for over two centuries. Now houses scale model of Henry VIII's Nonsuch Palace.","1 Malden Road, Cheam, SM3 8QD",51.3593955,-0.2171867,10:00:00,17:00:00,No,
Wiener Holocaust Library,https://programme.openhouse.org.uk/listings/5343,"Sensitive yet bold refurbishment of historic Grade II listed townhouse for The Wiener Library including dramatic first floor reading room, mezzanine and ground floor exhibition spaces.","29 Russell Square, WC1B 5DP",51.52163239999999,-0.1279933,12:00:00,16:00:00,No,
William Morris Society - Kelmscott House,https://programme.openhouse.org.uk/listings/2387,"Residence of Sir Francis Ronalds, George MacDonald and (from 1878-96) William Morris. Organised by William Morris Society. Access to The William Morris Society's premises in the Coach House and basement only, includes current exhibition.","26 Upper Mall, W6 9TA",51.4905675,-0.2355918,12:00:00,17:00:00,No,
Wimbledon Windmill,https://programme.openhouse.org.uk/listings/2396,"Rare example of a hollow post mill (1817). Grade II* listed, it now contains a museum depicting the history and development of windmills in Britain. Many working models, windmill machinery, equipment and tools.","Windmill Road, Wimbledon Common, SW19 5NR",51.4349765,-0.2318027,14:00:00,17:00:00,No,
Zoroastrian Centre For Europe (formerly Grosvenor Cinema),https://programme.openhouse.org.uk/listings/3433,"Grade II* listed Art Deco building with well-preserved interior. Auditorium with deep coved ribs; proscenium arch flanked by fluted columns. Restoration fully funded by  donations from Zoroastrian faith community, without government grants.","440-442 Alexandra Avenue, Harrow, Middlesex, HA2 9TL",51.57401170000001,-0.3706816,11:00:00,15:00:00,No,
