name,url,description,address,latitude,longitude,start_time,end_time,ticketed_events,fully_booked
Primrose Hill House,https://programme.openhouse.org.uk/listings/11820,"This 1960s house in Primrose Hill is a detached property in a Modernist estate of brick courtyard houses. Our project reconfigured the internal layout and added a rooftop extension, whilst improving the house's thermal performance.","6 Conybeare, NW3 3SD",51.5425842,-0.1640499,10:00:00,17:00:00,No,
Public art trail: Portraits of the South,https://programme.openhouse.org.uk/listings/12255,"Public art trail: Portraits of the South by Abi Partington-Moran 

This innovative artist-created trail in Sutton Town Centre is the first of four Sutton STEAMS Ahead photographic commissions to be unveiled this Autumn/Winter.","Sutton High Street, SM1 1LT",51.36327,-0.19316,00:00:00,23:59:00,No,
Pushkin House,https://programme.openhouse.org.uk/listings/4108,The independent cultural centre Pushkin House will contribute to this year's Open House Festival through a programme of events and community initiatives at its Grade-II listed building in Bloomsbury Square.,"5a Bloomsbury Square, WC1A 2TA",51.5182912,-0.1230772,12:00:00,16:00:00,Yes,Yes
Quaker Meeting House - Brentford & Isleworth,https://programme.openhouse.org.uk/listings/2688,"Grade II* listed late-Georgian Quaker Meeting House (1785) set in garden with burial ground. Meeting room has wood panelling, elders' bench, upper gallery with drop shutters, and fine brickwork detailing. Contemporary brick boundary wall.","Quakers Lane, Isleworth, TW7 5AZ",51.4791863,-0.3260394,10:00:00,16:00:00,Yes,Yes
Quaker Meeting House - Wandsworth,https://programme.openhouse.org.uk/listings/1422,"Grade II listed, this is the oldest Quaker meeting house in London. Built in 1778, it has original panelling & a minister's gallery. See flagstones from the earlier 1674 buildings. Also a secluded burial ground & garden. Free refreshments.","59 Wandsworth High Street, Wandsworth, SW18 2PT",51.4565224,-0.1917397,12:00:00,16:00:00,No,
RIBA,https://programme.openhouse.org.uk/listings/1464,Fine example of Grade II* listed 1930s architecture with many original features and fittings and home to the world-class British Architectural Library collections.,"66 Portland Place, W1B 1AD",51.5211811,-0.1451121,11:00:00,16:00:00,No,
Roca London Gallery,https://programme.openhouse.org.uk/listings/5322,"Designed by the world renowned Zaha Hadid Architects, Roca London Gallery is a unique space where water acts as the architectural theme. Guests can also visit 'Small Spaces in the City: Rethinking Inside the Box', a major exhibition exploring the challenges and innovative solutions for small live-and-work spaces in the city.","Station Court, Townmead Road, SW6 2PY",51.4705297,-0.1850841,11:00:00,17:00:00,No,
Romanian Cultural Institute,https://programme.openhouse.org.uk/listings/5056,"Situated in one of the largest and grandest 19th century squares in London, 1 Belgrave Square was acquired by Romania in 1936 and is now home to the Romanian Cultural Institute.","1 Belgrave Square, SW1X 8PH",51.500248,-0.1539844,11:00:00,17:00:00,No,
"Rowley Way, Alexandra Road Estate - Residence",https://programme.openhouse.org.uk/listings/11956,"The Alexandra Road Estate is a low-rise, high-density, mixed-use development designed by Neave Brown for Camden's Architects' Department.","13b Rowley Way, NW8 0SF",51.53946,-0.18597,09:00:00,16:00:00,Yes,Yes
Royal Hospital for Neuro-disability,https://programme.openhouse.org.uk/listings/8198,The original Grade II listed house was a former Georgian villa. 3 extensions were added through the Victorian period reflecting the style of the era.  Subsequent additions reflect medical practices. An archivist will be giving free tours.,"Royal Hospital for Neuro-disability, West Hill, SW15 3SW",51.45162699999999,-0.2141958,11:00:00,15:45:00,Yes,Yes
Royal Opera House,https://programme.openhouse.org.uk/listings/1550,"Home to The Royal Opera, The Royal Ballet and the Orchestra of the Royal Opera House, the ROH was reconfigured in 2018 by Stanton Williams to offer world-class performance spaces and a welcoming and inclusive cultural and social hub.","Covent Garden, Bow Street , WC2E 9DD",51.5129211,-0.1221976,12:30:00,16:00:00,Yes,Yes
Sanitation and the City walking tour,https://programme.openhouse.org.uk/listings/11969,"From the Great Stink of London in 1858 to the Tideway 'Super Sewer' currently under construction, this walking tour will chart the development of London's sanitation infrastructure, past, present and future.","Outside the Lakeside Centre, Bazalgette Way, SE2 9AN",51.50096,0.12423,13:30:00,16:30:00,Yes,Yes
Saturday School: Quakers Hall,https://programme.openhouse.org.uk/listings/12243,"Assembled in the format and spirit of a Saturday School, this session, supported by Theatrum Mundi, will take place in the Croydon Quaker's Adult School Hall and support participants to map out spaces of care & resistance across Croydon.","The Adult School Hall, 60 Park Lane, CR0 1ER",51.37037,-0.09722,11:00:00,17:00:00,No,
Scadbury Moated Manor,https://programme.openhouse.org.uk/listings/11382,See the archaeological excavations and Tudor foundations at Scadbury Moated Manor - which still has its moat around it.,"Scadbury Moated Manor, Perry Street, Chislehurst, BR7 6LN",51.414806,0.0872352,14:00:00,17:00:00,No,
"Secret Victoria, Westminster",https://programme.openhouse.org.uk/listings/7774,,"Cardinal Place, Victoria Street , SW1E 5JE",51.4971002,-0.141117,12:00:00,16:30:00,No,
Senate House,https://programme.openhouse.org.uk/listings/1617,"London’s tallest secular building when it opened as the HQ of the University of London and home to the Ministry of Information during WWII, this Grade II* listed landmark features Classicism and Art Deco elements.","University of London, Malet Street, WC1E 7HU",51.5229378,-0.1308206,11:00:00,16:00:00,No,
Shaftesbury Theatre,https://programme.openhouse.org.uk/listings/152,Built in a Renaissance style with high level Diocletian windows and a prominent grand cupola. In 2016 a new Fly Tower opened followed by remodelling of the auditorium in 2018 and the creation of a new basement space opening in the Autumn.,"210 Shaftesbury Avenue, WC2H 8DP",51.516203,-0.1261448,09:00:00,11:45:00,Yes,Yes
Shrewsbury House,https://programme.openhouse.org.uk/listings/7175,"Built in 1923, to replace its 18C namesake, Grade ll listed Shrewsbury House is the focus of the Shrewsbury Park Estate conservation area, built 1934-1936 by John Laing and Sons. Two Civil Defence centres are within the grounds.","Shrewsbury House, Bushmoor Crescent, SE18 3EG",51.4736553,0.0722406,10:00:00,16:00:00,Yes,Yes
Sitopia Farm,https://programme.openhouse.org.uk/listings/12266,"Sitopia Farm is a 2-acre organic and regenerative farm in the London Borough of Greenwich, producing vegetables, fruit and flowers for local people and businesses. We believe we can and should grow more food in the city/","331 Shooters Hill, DA16 3RP",51.46739,0.07925,10:00:00,14:00:00,No,
Spruce House,https://programme.openhouse.org.uk/listings/11750,"Ao-ft co-founders', Liz Tatarintseva and Zach Fluker,  Spruce House and Studio is the pair’s joint home in east London’s Walthamstow. Not only has it been a personal labour of love, it’s also the first flagship project of the practice owners' newly minted architecture practice.","56 Beulah Road, E17 9LQ",51.58139,-0.01034,10:30:00,15:30:00,No,
"St Anne's Church, Limehouse",https://programme.openhouse.org.uk/listings/6270,"St Anne's Limehouse has been described as 'the finest parish church in England.' Designed by Nicholas Hawksmoor, it is Grade I listed and one of the Major Churches in the Church of England. It is home to a thriving Christian congregation.","Three Colt Street, E14 8HH",51.5107426,-0.0303782,10:00:00,16:00:00,No,
St Augustine of Canterbury,https://programme.openhouse.org.uk/listings/2489,Victorian/Arts and Crafts church completed in 20C. Imposing west front by J Harold Gibbons with statuary by Dorothy Rope. Lady chapel by Henry Wilson. Stained glass by Margaret Aldridge Rope. Fine Hunter organ plus case.,"Corner Archway Road & Langdon Park Road, N6 5BH",51.5713748,-0.1385812,12:00:00,16:00:00,No,
St Barnabas Church,https://programme.openhouse.org.uk/listings/2491,"Early English style, full of Pre-Raphaelite decoration. Important works by Bodley, Comper and Cundy and windows by Kempe and Tower. First Oxford Movement church. Recently restored 10 bell peal","St Barnabas Street, SW1W 8PF",51.4900687,-0.1519005,00:00:00,23:59:00,No,
St Bernard's Houses,https://programme.openhouse.org.uk/listings/4811,"21 houses, in 3 terraces, built by Swiss architects Atelier 5 for Wates. Living areas on the upper floor are approached through a garden court. Bedrooms downstairs open to a lower garden. Pevsner wrote, 'a group with few equals in Britain'.","Meet: by OH banner, St Bernard's, Chichester Road, Croydon, CR0 5UL",51.3701308,-0.0854432,14:00:00,17:00:00,Yes,Yes
St John on Bethnal Green,https://programme.openhouse.org.uk/listings/11832,"This grade one listed Sir John Soane church sits in the heart of the Bethnal Green in East London. Despite a fire in 1870, some original features remain. Visitors will have access to the church,  belfry, galleries and crypt.","St John on Bethnal Green, 200 Cambridge Heath Road, E2 9PA",51.5275283,-0.0547752,10:00:00,16:00:00,No,
St John the Divine,https://programme.openhouse.org.uk/listings/3397,St John’s has a wide nave approached via a narthex formed under the gallery running the width of the west end.  East of the nave is a chancel flanked to the south by the Lady Chapel and to the north by the organ chamber with loft over.,"Kew Road, Richmond, Surrey, TW9 2NA",51.4760605,-0.29128,10:00:00,12:00:00,No,
"St John the Evangelist, Kingston upon Thames",https://programme.openhouse.org.uk/listings/7702,"The church is a large victorian building with an interesting beautiful interior. The foundation stone was laid in 1871 by Bishop Samuel Wilberforce, son of the anti-slavery campaigner, William.","Grove Lane, Kingston upon thames, Kingston upon Thames, KT1 2SU",51.4025463,-0.2985612,10:00:00,13:00:00,No,
"St Luke’s Catholic Church, Pinner",https://programme.openhouse.org.uk/listings/11890,"A suburban post-war Catholic church built in a neo-Romanesque version of the continental modern style by Velarde, next to the original neo-gothic church from 1915, now a parish centre, and alongside the modernistic 1960s parish hall.","28 Love Lane, Pinner, HA5 3EX",51.59537210000001,-0.3829307,13:00:00,17:00:00,No,
St Mary Magdalene,https://programme.openhouse.org.uk/listings/5810,"A historic living parish church, progressively shaped from the Tudor to the Edwardian period. St Mary's has recently undergone a major refurbishment and the newly restored windows recapture the original airiness of the C18 nave.","Paradise Road, Richmond, TW9 1SN",51.4602497,-0.3016406,10:00:00,15:00:00,No,
St Mary the Virgin,https://programme.openhouse.org.uk/listings/2528,"Small Grade I listed 12C chapel in lovely churchyard setting, it retains original architectural features and has interesting brasses, monuments and stained glass windows.","Church Road, Manor Park, Little Ilford, E12 6HA",51.5485444,0.0586338,11:00:00,16:00:00,No,
St Mary's Church Bromley,https://programme.openhouse.org.uk/listings/11317,"A plain Victorian Church set in a wooded Churchyard, with a vibrant and striking set of Murals around the altar and the Choir. 
Has indoor toilet facilities. 
A good quality well used organ in good condition, and an excellent accoustic","St Mary's Church, College Road, Bromley, BR1 3QG",51.4130778,0.015066,10:00:00,12:00:00,No,
"St Mary's Church, Battersea",https://programme.openhouse.org.uk/listings/2533,Classic Grade I listed Georgian church with outstanding interior and monuments. Renovated 2019/20.,"Battersea Church Road, SW11 3NA",51.4765358,-0.1747989,12:00:00,17:30:00,No,
St Matthew's Church,https://programme.openhouse.org.uk/listings/11020,"St Matthews is Grade II listed, built 1883-4 and designed by the architect Alfred Jowers. 
It features a WW1 memorial screen designed by Reginald Hallward and stained glass some believed to be by Edward Frampton","St Matthews church, North Common Road, W5 2QA",51.51317299999999,-0.2958622,10:00:00,17:00:00,No,
St Nicholas Church,https://programme.openhouse.org.uk/listings/6916,"Built in the Gothic style with dressed flint and stone dressings. There are monuments to Joseph Glover (1628), Lady Dorothy Brownlow (1699), William Earl Talbot (1782) and Isaac Littlebury (1740). The churchyard has 5 Grade II tombs.","St Nicholas Way, Sutton, SM1 1ST",51.3624214,-0.1948925,10:00:00,16:00:00,No,
"St Paul's, Newington",https://programme.openhouse.org.uk/listings/2556,"Modern architecture church with large copper and lead roof and concrete, brick and stained glass external structure. Marble, wood and plaster interior and artwork by Sculptor Freda Pinto and Gerald Holtom.","Walworth Road, Lorrimore Square, SE17 3QU",51.4849094,-0.1019112,11:00:00,14:00:00,No,
Stanley Arts,https://programme.openhouse.org.uk/listings/4825,"A public hall, theatre and gallery in grand Edwardian style. Grade II listed, Stanley made fun of the Victorian style with grand ornamentation. It reflects Stanley's interest in science, the arts and public cultural improvement.","12 South Norwood Hill, SE25 6AB",51.4001227,-0.0754022,11:00:00,17:00:00,Yes,Yes
Stories from…The Welsh Chapel,https://programme.openhouse.org.uk/listings/12248,An exhibition exploring the rapid technological changes in transport in the Sutton New Town Area (1870-1911). The Welsh Chapel is part of the Presbyterian Church of Wales - originally built as a Primitive Methodist Chapel in 1879.,"Lind Road, Sutton, Greater London, SM1 4PJ",51.36336,-0.18523,10:00:00,16:00:00,No,
Streamline in the Suburb,https://programme.openhouse.org.uk/listings/11773,"A walking tour exploring the 1930s Streamline Moderne architecture of Hampstead Garden Suburb, led by Joe Mathieson of the Hampstead Garden Suburb Trust. 

1 of 3 walks run by the Trust.","East Finchley tube, N2 0NW",51.58711049999999,-0.1645653,10:00:00,12:30:00,Yes,Yes
Streatham Space Project Family Day,https://programme.openhouse.org.uk/listings/11734,"A free family day out for the littleuns, bigguns and middleuns! Come see our unique, purpose built live arts venue, and enjoy some of the free family activities on offer. Streatham Space Project is neighbourhood arts venue and charity.","Sternhold Avenue, SW2 4PA",51.4387922,-0.1282771,10:00:00,14:00:00,No,
Sugar House Island,https://programme.openhouse.org.uk/listings/12036,"Sugar House Island is a brand-new 26 acre mixed use neighbourhood of homes, offices, creative spaces, retail, education and public outdoor space.  The development combines modern architecture with retained heritage features. This incudes Talent House, a new state-of-the-art creative hub for next generation of music and dance professionals, and is supported by the Mayor of London.","Vastint UK, 135 High Street, Stratford, E15 2RB",51.53239,-0.00894,10:30:00,17:00:00,Yes,Yes
T J Boulting,https://programme.openhouse.org.uk/listings/10748,Red brick and Portland stone corner building with three prominent signs in Arts & Craft style lettering in green and gold mosaic for the company 'TJ Boulting & Sons'.,"59 Riding House Street, W1W 7EG",51.5192759,-0.1393736,11:00:00,17:00:00,No,
Talks at The Thorney Island Society Archives,https://programme.openhouse.org.uk/listings/11805,"Victor Keegan, author of two acclaimed books on Lost London, asks how the streets around the Thorney Island Society Archives in Old Pye Street could have been so lawless and deprived, so close to Westminster Abbey and Parliament.","10 Old Pye Street, SW1P 2DG",51.49751389999999,-0.1309298,10:00:00,16:00:00,No,
Temple Bar,https://programme.openhouse.org.uk/listings/1983,"Temple Bar is a 350 year old gateway to the City of London, designed by Sir Christopher Wren. It formerly stood in Fleet Street, and was the last surviving gateway to the City of London.","First Floor, Paternoster Lodge, 2 Paternoster Square, EC4M 7DX",51.5142882,-0.0993242,10:00:00,16:00:00,No,
The Africa Centre,https://programme.openhouse.org.uk/listings/10989,A 1960s former office block that has been transformed into a vibrant cultural hub showcasing the best of contemporary African culture and heritage. This project is supported by the Mayor of London.,"66 Great Suffolk St, SE1 0BL",51.5030975,-0.1014811,12:00:00,18:00:00,Yes,Yes
The Association of Anaesthetists and Anaesthesia Heritage Centre,https://programme.openhouse.org.uk/listings/7736,"Grade II listed building with neoclassical portico. Highly decorated meeting rooms throughout the building with ceiling and wall mouldings, and artwork featuring Venus the Goddess of Love and the Greek Muses.","21 Portland Place, Marylebone, W1B 1PY",51.5193726,-0.1450566,10:00:00,15:40:00,Yes,Yes
The Barbican & The City Gardens,https://programme.openhouse.org.uk/listings/12009,"Built on the site destroyed by The Blitz during the World War II, The Barbican Estate is a fascinating area and an icon of Brutalist architecture. Architects were Chamberlain, Powell and Bon,  We  will also visit several amazing gardens.","Guildhall Yard, EC2V 5AF",51.51543,-0.09204,10:45:00,16:00:00,No,
The Cumberland Hotel,https://programme.openhouse.org.uk/listings/11989,"Discover the breathtaking interior of London's iconic 1700s landmark, The Cumberland Hotel. Immerse yourself in its rich artistic history, once home to renowned artists. Join us to experience the allure of this extraordinary venue.","The Cumberland Hotel, Great Cumberland Place, W1H 7DL",51.5138,-0.15849,09:00:00,16:45:00,No,
The Department Store,https://programme.openhouse.org.uk/listings/7607,"The Department Store is an award winning refurbishment of a dilapidated Edwardian building in Brixton, completed by Squire and Partners in 2017. The design was informed by the layers of history and existing fabric of the heritage building.","The Department Store, 248 Ferndale Road, SW9 8FR",51.4640281,-0.1154794,10:00:00,13:00:00,Yes,Yes
The Earls Court Development Company,https://programme.openhouse.org.uk/listings/11086,Learn about our plans to transform this 40-acre site into a largely car free mixed use development that aims to go beyond net zero and bring the wonder back to Earls Court,"Earls Court Project Rooms, 16-18 Empress Place, SW6 1TT",51.4872526,-0.1978557,12:00:00,14:00:00,Yes,Yes
The Egypt Exploration Society (EES),https://programme.openhouse.org.uk/listings/11679,The EES is a charity supporting and promoting Egyptian cultural heritage located in 3-4 Doughty Mews. We propose an Open Day on Saturday 9th September with collections tours and an exhibition of the history and archaeology of the building.,"The Egypt Exploration Society, 3-4 Doughty Mews, WC1N 2PG",51.523079,-0.116958,10:00:00,16:00:00,No,
The Gilbert & George Centre,https://programme.openhouse.org.uk/listings/7098,"The Gilbert & George Centre was originally established as a registered charity by the artist in 2009 with the objective to advance the education of the public in the arts, and generally to advance the arts, architecture, heritage and culture for the benefit of the public.","Heneage St, E1 5LJ",51.51886,-0.07113,10:00:00,17:00:00,Yes,Yes
"The Great Barn, Harmondsworth",https://programme.openhouse.org.uk/listings/2050,"The timbers of this great medieval barn (1426-7), over 190 feet long and nearly 40 feet high, are 95% original. Displays include the conservation/repairs carried out in 2014 and its place in the agricultural history of the village.","Manor Court, High Street, Harmondsworth, UB7 0AQ",51.4886271,-0.4796831,10:00:00,17:00:00,No,
The Great Fire of London,https://programme.openhouse.org.uk/listings/10238,"In 1666, the conflagration devastated most of the City, thousands of houses, many churches and St Paul's Cathedral destroyed. Christopher Wren played a major role in rebuilding the City. 
Free walks led by City of London Guides","Guildhall Yard, Gresham Street, EC2V 7HH",51.5151073,-0.09212719999999999,10:00:00,15:15:00,No,
The Life Cycle of London's Landscape,https://programme.openhouse.org.uk/listings/12283,"The life cycle of London’s landscape starts with history. History becomes an integral part of it from the very inception of its design, enriched through construction, and expands even after the building’s completion. As architectural landscapes are repurposed for contemporary needs, they continue to respond to challenges and stigmas of marginalised communities. 

Join us on Saturday 9th September (11am-1pm) to discuss what happens when people inhabit landscapes and new communities emerge. 

As landscapes mature, we are given a choice: to ignore or embrace what came before.

What happens when the histories of these communities are neglected?","Aga Khan Centre, 10 Handyside Street, N1C 4DN",51.53757,-0.1248,11:00:00,13:00:00,Yes,Yes
The Listening Space Garden,https://programme.openhouse.org.uk/listings/11769,We are a community-led garden in the heart of an urban general practice. The garden has been our seedbed and hothouse allowing us to widen the traditional prescription beyond pills and procedures,"Caversham Group Practice, NW5 2UP",51.55078049999999,-0.1382223,11:00:00,16:00:00,No,
The Making of Pimlico,https://programme.openhouse.org.uk/listings/10307,"A walking tour exploring  the work of early 19th century master-builder, Mr Cubitt. Explores how the area has changed and been shaped by some of the important and influential planning, housing and design ideas of its time.",Pimlico Tube station - Rampayne Street entrance street level.,51.4892548,-0.133332,11:00:00,13:00:00,Yes,Yes
The Marshall Building - London School of Economics and Political Science,https://programme.openhouse.org.uk/listings/10875,"A large multi-purpose building occupying a pivotal position at the southern corner of Lincoln’s Inn Fields.  The building provides state of the art, flexible teaching spaces on the lower levels and faculty accommodation on the upper levels.","The Marshall Building, 44 Lincoln's Inn Fields, WC2A 3PF",51.5149908,-0.1167547,10:00:00,16:00:00,No,
The Mysterious Black Tudors - Westminster Family Trail,https://programme.openhouse.org.uk/listings/10427,Celebrate the Open House Festival with this fun and interactive family event about Britain's forgotten history of the Black Tudors.,"Westminster Abbey, Broad Sanctuary, SW1P 3JS",51.4993695,-0.1272993,10:30:00,12:00:00,Yes,Yes
The National Archives,https://programme.openhouse.org.uk/listings/1413,South West London's hidden Brutalist masterpiece.,"Ruskin Avenue, Kew, Richmond, Surrey, TW9 4DU",51.4810089,-0.2799779,09:30:00,17:00:00,Yes,Yes
The Questors Theatre,https://programme.openhouse.org.uk/listings/7064,"Originally planned in 1954, the first new theatre after the war, the Questors Playhouse opened in 1964, by which time its design had been followed by the Chichester Festival Theatre and the Crucible, Sheffield.","The Questors Theatre, 12 Mattock Lane, W5 5BQ",51.51156169999999,-0.3095093,10:00:00,17:00:00,No,
The Round House,https://programme.openhouse.org.uk/listings/2130,Grade II* listed late Georgian elliptical 3-storey stuccoed villa.,"Broxhill Road, Havering-atte-Bower, Romford, RM4 1QH",51.6161082,0.1961176,10:30:00,18:00:00,No,
The Swedenborg Society,https://programme.openhouse.org.uk/listings/889,"Grade II-listed Georgian domestic building c.1760, formerly part of Bedford Estate. Interior refurbished 1924-5 to form lecture hall (restored 2014), library, bookshop and offices. Oak woodwork and green Doulton tiles line the staircase.","Swedenborg House, 20-21 Bloomsbury Way, WC1A 2TH",51.5180333,-0.1228486,11:00:00,17:00:00,Yes,Yes
Thornhill Square,https://programme.openhouse.org.uk/listings/10893,"A tour of one of the largest and best preserved early Victorian squares and gardens in London, also with a magnificent and original public library of 1906, which shows Byzantine and Art Nouveau influences, and a remarkable Gothic church.","Meet outside the main door of St Andrew’s Church, Bridgeman Road",51.541114,-0.1152717,10:00:00,16:40:00,Yes,Yes
Timothy Hatton Architects – The Foundry,https://programme.openhouse.org.uk/listings/11069,"Tucked behind a busy road in W12, this former foundry is a multi-level development featuring an architects’ studio with courtyards and spaces for exhibitions and musical performances. The  building's 15m brick chimney is a local landmark.","The Foundry, 1 Adelaide Grove, W12 0JU",51.5067505,-0.2373949,11:00:00,17:00:00,No,
Tin House,https://programme.openhouse.org.uk/listings/6428,"Making efficient use of an irregular urban site, this house is made up of interconnecting top-lit pavilions arranged to define a tranquil private courtyard.","Smugglers Yard, Devonport Road, W12 8PB",51.50423,-0.23093,10:00:00,13:00:00,No,
Tommy Flowers at Chartwell Court (ex Post Office Research Station Dollis Hill),https://programme.openhouse.org.uk/listings/12039,"Former research establishment where Tommy Flowers built Colossus, the world's first programmable electronic computer in 1943. Blue plaque to be unveiled on 6 Sep 2023","Chartwell Court, 151 Brook Rd, Neasden, NW2 7DW",51.56155,-0.23838,10:00:00,16:30:00,Yes,Yes
Tour of Convoys Wharf,https://programme.openhouse.org.uk/listings/11780,"We will open our site for a walking tour around our historic former naval dockyard, which will soon be transformed into a modern redevelopment. Learn about our historic Olympia Building and the former Deptford Dockyard.","Prince Street, Deptford, SE8 3LJ",51.4834764,-0.0278824,09:00:00,13:00:00,Yes,Yes
