name,url,description,address,latitude,longitude,start_time,end_time,ticketed_events,fully_booked
Gaunson Creative Open Studios part of Markfield Road Festival,https://programme.openhouse.org.uk/listings/11380,"Gaunson Creative Studios in South Tottenham, home to over 70 artist studios, will be opening its doors for the first time since 2019. Visitors will be able to meet and buy from over 50 artists across the weekend.","Gaunson Creative Studios, Gunson House, Markfield Road, N15 4QQ",51.5838118,-0.0635681,14:00:00,18:00:00,No,
"Grand Junction at St Mary Magdalene Church, Paddington",https://programme.openhouse.org.uk/listings/2527,"Grade I Victorian Gothic church by G E Street, architect of the Royal Courts of Justice. The recent conservation project reveals the majestic colours of Daniel Bell's painted ceiling, plus Dow Jones Architects' contemporary heritage wing.","Rowington Close, St Mary Magdalene's Church , W2 5TF",51.5222702,-0.1890094,11:00:00,15:00:00,Yes,Yes
Greenwich Yacht Club,https://programme.openhouse.org.uk/listings/522,"Contemporary timber and aluminium building using existing pier, offering unique views of the river, the O2 and the Thames Barrier.","1 Peartree Way, SE10 0BW",51.494727,0.0177407,12:00:00,16:00:00,No,
"Grow, Hackney",https://programme.openhouse.org.uk/listings/10743,"Repurposed out of a disused sausage factory, Grow was converted into a grassroots venue, community hub, bar and kitchen. This canalside venue is part of an ecosystem of artist studios & small independent businesses & working yard.","98c Wallis Road, Main Yard, Hackney Wick, E9 5LN",51.54371769999999,-0.0226673,10:00:00,23:45:00,No,
"Guided walk: Edward Harris Rabbits, and the development",https://programme.openhouse.org.uk/listings/12249,E H Rabbits (1818-74) was a major contributor to the development of suburban Sutton.This linear walk will look at a number of the buildings he is associated with an other sites on the way to illustrate the Victorian development of Sutton.,"Sutton Railway Station, High Street, Sutton, SM1 1JA",51.35966,-0.19116,11:00:00,12:30:00,Yes,Yes
Guildhall Art Gallery,https://programme.openhouse.org.uk/listings/1405,"Open daily 10.30am-4pm. 
Guided tours 12.15pm & 1.15pm on Tuesdays, Thursdays, Fridays, Saturdays & Sundays, see below.
Home of the City of London's art collection, & remains of London's Roman Amphitheatre","Guildhall Yard, EC2V 5AE",51.5152512,-0.0921379,11:00:00,15:30:00,Yes,Yes
Hackney School of Food,https://programme.openhouse.org.uk/listings/11732,"Meet the Architects Tour
Hackney School of Food, Oswald Street, Lower Clapton, E5 0BT
9 September 1030-130pm
Tour of our award-winning kitchen & gardens led by our architects, Surman Weston and the team behind our food education hub.","Hackney School of Food, Oswald Street, E5 0BT",51.5577581,-0.0399719,10:30:00,13:00:00,Yes,Yes
Hammersmith Quaker Meeting House,https://programme.openhouse.org.uk/listings/5929,"This new Quaker Meeting House is designed to be highly sustainable. It embodies the Quaker values of simplicity and equality, promoting a sense of calm.","30-32 Bradmore Park Rd, London W6 0DT, W6 0DT",51.4955364,-0.2318909,10:00:00,14:00:00,No,
Havant House 53,https://programme.openhouse.org.uk/listings/11119,"A victorian mid terrace house with a dark blue exterior and a zany tiled front garden. Full of original features without being dictated by the era, colour continues inside with a yellow rubber floor in the kitchen.","53 Havant road, Walthamstow, E17 3JE",51.58836729999999,-0.0069079,10:00:00,13:30:00,Yes,Yes
Hinde Street Methodist Church,https://programme.openhouse.org.uk/listings/9976,"Hinde Street Methodist Church was constructed in 1887 with a grand pillared portico, spire and classical interior which remains largely unaltered. The entrance foyer was remodelled in 2014, to give the church a more welcoming appearance.","19 Thayer Street, W1U 2QJ",51.5171666,-0.151156,10:00:00,16:00:00,No,
Historic & Modern Buildings in the City,https://programme.openhouse.org.uk/listings/10240,"On this walk we will see many historic & modern buildings. see different architecture styles having regard to the environment and sustainability, and hear about famous architects, past and present.

Free walks led by City of London Guides","Guildhall Yard, EC2V 7HH",51.51543,-0.09204,10:15:00,15:30:00,No,
Holy Trinity Church Sloane Square,https://programme.openhouse.org.uk/listings/649,"A sumptuous feast of Victorian stained glass & bold sacred sculpture in what Sir John Betjeman called the 'cathedral of the Arts and Crafts movement.' Work by William Morris, Edward Burne-Jones, William Blake- Richmond & Christopher Whall.","146 Sloane Street (just off Sloane Square), SW1X 9BZ",51.4931409,-0.157482,10:00:00,16:00:00,No,
Honeywood Museum,https://programme.openhouse.org.uk/listings/3939,Chalk and flint house dating to 17C with additions including extensions of 1896 and 1903 when owned by John Pattinson Kirk. Rich in period detail and the interior restored and stairs opened up with funding from the Heritage Lottery Fund.,"Honeywood Walk, Carshalton, SM5 3NX",51.3660834,-0.1655658,10:00:00,17:00:00,No,
Hornsey Library,https://programme.openhouse.org.uk/listings/10973,"Hornsey Library is a Grade II listed building, featuring Huxley-Jones' ""Reclining figure"" sculpture and the intricately etched glass ""Hornsey window"". A recent refurbishment has added practical updates while keeping the 1960s aesthetic.","Hornsey Library, Haringey Park, Haringey, N8 9JA",51.578152,-0.1221064,11:00:00,12:00:00,Yes,Yes
Housing in Kennington: A royal intervention,https://programme.openhouse.org.uk/listings/11964,This walking tour around Kennington focuses on housing projects and particularly those developed by the Duchy Estate before and after World War I. The walk will provide an insight into the way public housing contributes to the mix of inhabitants in this sometimes forgotten area of London – drawing comparisons in relation to London as a whole.,"Outside Kennington Tube Station, Kennington Park Rd, SE11 4JQ",51.48827,-0.10561,11:00:00,13:00:00,Yes,Yes
Huguenots' heritage in Spitalfields,https://programme.openhouse.org.uk/listings/11971,"Huguenots had a huge impact on London’s culture, commerce and industry from the 17th century onwards. But how much do we really know about them? During this walk we will discover and explore the  history of Spitalfields.","Outside hub by Premier Inn London Spitalfield, 86 Brick Lane, E1 6RL",51.51929,-0.07158,10:00:00,11:45:00,Yes,Yes
Industry and change through Hackney Wick,https://programme.openhouse.org.uk/listings/11982,"This walk focuses on industry, creativity and change in Hackney Wick and Fish Island, exploring how regeneration and gentrification have transformed the area.","Hackney Wick Overground Station, White Post Lane, E9 5TS",51.54354,-0.02415,14:00:00,16:00:00,Yes,Yes
International Maritime Organization,https://programme.openhouse.org.uk/listings/7730,"The International Maritime Organization is a specialized agency of the UN, responsible for the safety and security of shipping and the prevention of marine pollution by ships. It is the only UN organization with headquarters in London.","4 Albert Embankment, SE1 7SR",51.4936018,-0.1210654,10:00:00,16:00:00,No,
Jonathan Tuckey Design Studio,https://programme.openhouse.org.uk/listings/8213,This transformation of a derelict pub into an architecture studio doubles up as a gallery and lecture theatre. The new office is an example of the practice’s approach towards existing structures and intelligent architectural interventions.,"58 Milson Road, W14 0LB",51.4987228,-0.2141963,10:00:00,17:00:00,No,
Kempton Steam Museum,https://programme.openhouse.org.uk/listings/10239,1920s water pumping station comprising of several architectural styles. Interior retains original steam pumping machinery and historic electrical equipment.,"Kempton Park Pumping Station, Snakey Lane, TW13 6XH",51.4317281,-0.4101565,10:30:00,16:00:00,No,
Kenwood,https://programme.openhouse.org.uk/listings/835,"A striking Neoclassical villa in tranquil gardens on Hampstead Heath, Kenwood boasts breath-taking interiors by Robert Adam and a world-class art collection. For guaranteed entry, book your free ticket via the English Heritage website.","English Heritage, Hampstead Lane, NW3 7JR",51.5713284,-0.1675998,10:30:00,16:00:00,No,
Kenworthy Road,https://programme.openhouse.org.uk/listings/11990,"This a new self-build house by two architect friends, Anthony Engi Meacock and Alexander Hills, on a narrow infill site within a late Victorian terrace.","89A Kenworthy Road, E9 5RB",51.54551,-0.03557,11:00:00,17:30:00,Yes,Yes
"King's Cross Heritage, Energy Centre and Garden Tours",https://programme.openhouse.org.uk/listings/499,"King's Cross is a 67 acre development in Central London being transformed into a new city quarter with 20 regenerated heritage buildings, new homes, offices, public spaces, shops, galleries, bars, restaurants, schools and a university.","Western Transit Shed, 11 Stable Street, King's Cross, N1C 4AB",51.5366294,-0.1252866,10:30:00,15:30:00,Yes,Yes
King's Cross Masterplan,https://programme.openhouse.org.uk/listings/7788,The King’s Cross Masterplan established a framework for the incremental redevelopment of this industrial heritage site through a mix of uses and a network of public spaces structuring new urban blocks and knitting the site into its context.,"11 Stable Street, N1C 4AB",51.5366379,-0.12543,14:00:00,16:00:00,Yes,Yes
Kingston Guildhall and History Centre,https://programme.openhouse.org.uk/listings/6960,"Built in the Georgian style, the Guildhall brought together Kingston's administrative functions. Purpose-built Magistrates Courts were included in the building, part of which are now home to Kingston History Centre.","High Street , Kingston upon Thames, KT1 1EU",51.4065434,-0.3080235,10:00:00,16:30:00,Yes,Yes
Kingston Historic walk,https://programme.openhouse.org.uk/listings/7678,"We are running our usual guided walking tours around historic Kingston this year with reduced numbers.

Our guided tours are informative, interesting and fun. For more information about us visit: https://www.kingstontourguides.org.uk/","Market house, Kingston upon Thames, KT1 1JX",51.40975359999999,-0.3062179,11:00:00,12:30:00,Yes,Yes
"Kingston Library, Museum and Art Gallery",https://programme.openhouse.org.uk/listings/781,"Adjoining Grade II listed Carnegie-funded library, museum and art gallery. Museum holdings range from ceramics to topographical drawings, including the collection left by Eadweard Muybridge, a native of Kingston and photographic pioneer.","Wheatfield Way, Kingston upon Thames, KT1 2PS",51.4094037,-0.3007265,10:00:00,17:00:00,No,
Lambeth Palace Library,https://programme.openhouse.org.uk/listings/10965,"A significant new redbrick addition to London’s civic architecture, Lambeth Palace Library is the first new building on the site for 185 years and hosts the Church of England’s archive.","15 Lambeth Palace Road, SE1 7JT",51.49518140000001,-0.1207935,10:00:00,17:15:00,Yes,Yes
Leathersellers' Hall,https://programme.openhouse.org.uk/listings/3489,"New Livery Hall behind a retained early 20th century façade. This is the seventh Hall in the Leathersellers' Company's history since its foundation in the Middle Ages, and is located on the site of its second Hall.","7 St Helen's Place, Bishopsgate, EC3A 6AB",51.5152593,-0.0822059,10:00:00,17:00:00,Yes,Yes
Lexi Cinema,https://programme.openhouse.org.uk/listings/10262,"A contemporary extension to the Lexi Cinema, providing a 2nd screen. The building is a composition of brick and stainless steel; a nod to the parapets of surrounding terraces and reflecting the ever-changing sky above.","194b Chamberlayne Road, NW10 3JU",51.5376199,-0.2224974,14:00:00,17:05:00,No,
Limehouse Town Hall,https://programme.openhouse.org.uk/listings/11670,"Limehouse Town Hall is a building and resource for artists and cultural producers, audiences and communities from Tower Hamlets and beyond to share ideas, celebrate, organise, and imagine a better here and now.","Limehouse Town Hall, 646 Commercial Road, E14 7HA",51.51209,-0.03134,10:00:00,17:00:00,No,
Lincoln's Inn,https://programme.openhouse.org.uk/listings/928,"Lincoln’s Inn has been an association of barristers for over 600 years. An 11-acre site combining gardens with mediaeval, Victorian, Georgian, and modern buildings, including banqueting halls, a law library, a chapel, and teaching space.","The Honourable Society of Lincoln's Inn, WC2A 3QB",51.5160414,-0.1132912,10:00:00,16:00:00,No,
Little Mouse Cheese Shop,https://programme.openhouse.org.uk/listings/12156,"Visit Little Mouse, an Edwardian shop in South Norwood with original wooden frontage and fascia that is now an artisan cheesemonger.","212A Selhurst Road, SE25 6XU",51.39786,-0.07719,10:00:00,16:00:00,No,
Lockwood Way Industrial Estate - Architect-Led Tours,https://programme.openhouse.org.uk/listings/11265,"An architect-led tour of the recent public realm improvements. The tour will also provide a chance to look inside the tap rooms, scooter shop and winery and speak to the makers, brewers and winemakers on the estate about their processes.","Lockwood Way Industrial Estate, Walthamstow, E17 5RB",51.5954843,-0.0428377,14:00:00,15:00:00,Yes,Yes
London Cable Car,https://programme.openhouse.org.uk/listings/5530,Tour exploring the civil engineering achievements of the construction of the cable car. Led by the London Cable Car engineers* and front-of-house team.,"Unit 1-4, Edmund Halley Way, SE10 0FR",51.4995722,0.007199,10:00:00,12:00:00,Yes,Yes
London Fire Brigade Memorial Hall,https://programme.openhouse.org.uk/listings/11781,"Open Day: LFB's grade II listed Memorial Hall, part of the LFB's Headquarters, opened in 1937. The hall is rarely seen by the public & contains stunning large memorials by Gilbert Bayes commemorating firefighters lost protecting London.","8 Albert Embankment, SE1 7SP",51.49253,-0.1215,11:30:00,16:30:00,Yes,Yes
"London Museum, West Smithfield",https://programme.openhouse.org.uk/listings/8380,"Join us to find out more about our incredible journey to create a new museum for London. Apply to join a special tour of the General Market (currently in construction), or come along to meet the architects and take part in free family-friendly drop-in activities.","General Market Building, Charterhouse Street, EC1A 9LY",51.5185885,-0.1051801,13:00:00,17:00:00,Yes,Yes
London Open Form Pavilion of Air,https://programme.openhouse.org.uk/listings/11855,"A floating roof of sound, GPS-triggered & accessed by headphones & Echoes app to playfully reframe public space as an essential community engagement. One of 15 in an international series drawing on Oskar & Zofia Hansen’s Open Form concept.","Kensington Gardens, W2 3XA",51.50478,-0.175,07:00:00,20:15:00,No,
London Scottish House (London Scottish Regimental Headquarters),https://programme.openhouse.org.uk/listings/11324,A Grade 2 listed former Territorial Army Drill Hall  featuring restored elements of the original 1882 design. It has a triple height central hall with the restored wrought iron balconies and roofing.  Notable Neo-Georgian design brickwork.,"London Scottish House, 95 Horseferry Road, Westminster, SW1P 2DX",51.4952653,-0.1331912,10:00:00,17:00:00,No,
London's Roman Amphitheatre,https://programme.openhouse.org.uk/listings/10902,"UPDATED: Open daily 10.30am-4pm Closed Mon 19 September.
Combined guided tours of Amphitheatre and Guildhall Art Gallery at 12.15pm & 1.15pm on Tuesdays, Thursdays, Fridays, Saturdays & Sundays.
The capital’s only known Roman Amphitheatre","London’s Roman Amphitheatre at Guildhall Art Gallery, Guildhall Yard",51.5155471,-0.0914547,11:00:00,15:00:00,No,
"Loop House, Teddington",https://programme.openhouse.org.uk/listings/11988,Bridgeman Road project is a refurbishment project of a three-storey house with an extension of the roof with a dormer. The outcome is a joyful interior with bold use of colours and materials.,"2 Bridgeman Road, Teddington, TW11 9AH",51.42558,-0.33256,10:00:00,17:00:00,Yes,Yes
Lumley Chapel,https://programme.openhouse.org.uk/listings/3747,"Saxon and Medieval former chancel of parish church, preserved  after remainder was demolished in 1864. Part C11, with many important post-Reformation monuments, including those to the family of John, Lord Lumley of Nonsuch Palace.","St Dunstan's Churchyard, Church Road, Cheam, SM3 8QH",51.360717,-0.2162826,13:30:00,16:00:00,No,
Manor Park Community Garden,https://programme.openhouse.org.uk/listings/11827,"Manor Park Community Garden was first established by local residents in 2012. . In 2020, a new group of residents saw an opportunity to reinvigorate the space, into an edible garden with fruit trees, asian vegetables and herbaceous flowers.","Manor Park Community Garden, E12 5AT",51.5518015,0.04555260000000001,12:00:00,15:00:00,No,
"Maxwell House, Brackenbury Village",https://programme.openhouse.org.uk/listings/11913,"Maxwell House is a unique architecturally designed open-plan 4 storey home. Its design and tapestries are inspired by its rich history as a textile shop, & the Roberts family of drapers who lived there for 40yrs from the late 19th Century.","108 Brackenbury Road, W6 0BD",51.4973167,-0.2316672,11:00:00,18:00:00,No,
Moravian Close,https://programme.openhouse.org.uk/listings/6835,"A former stable yard of Sir Thomas More's Chelsea estate, now an 18C Chapel, other buildings, and burial ground. Parts of the enclosing walls are Tudor in origin. Ernest and Mary Gillick enhanced the grounds in the 20C.","Moravian Close, 381 Kings Road, SW10 0LP",51.4836113,-0.1762358,13:00:00,17:00:00,No,
Mother X Artists and Makers Open Studios,https://programme.openhouse.org.uk/listings/11914,"Mother X is a diverse group of artists, makers & creators that have inhabited a former Victorian chocolate factory in Hackney Wick for 15+ years. Come visit this unique building & see it's people & their work during the Open House Festival.","Floor D, Unit 9 Queen's Yard, Hackney Wick, E9 5EN",51.54322,-0.02335,11:00:00,18:00:00,No,
Museum of Croydon Behind the Scenes Tour,https://programme.openhouse.org.uk/listings/12045,We propose to open the Museum of Croydon stores for an intimate guided tour of our stored collections also featuring an overview of collection care. This activity will take approximately 1hr and can cater for a maximum of 8 people.,"Croydon Clocktower, Katharine St, CR9 1ET",51.37226,-0.09939,10:00:00,11:45:00,Yes,Yes
National Liberal Club,https://programme.openhouse.org.uk/listings/1167,"An impressive Victorian neo-Classical building overlooking the Embankment of the river Thames. It is the second-largest clubhouse ever built, the first London building to incorporate a lift and to be entirely lit by electric lighting.","Whitehall Place, SW1A 2HE",51.5064534,-0.1236299,10:00:00,16:30:00,Yes,Yes
National Portrait Gallery Architecture Highlights Tours,https://programme.openhouse.org.uk/listings/12229,"Discover the architecture of the National Portrait Gallery, designed in 1896 by Ewan Christian and now transformed by Jamie Fobert Architects. Please meet at the Ross Street Entrance. Drop-in 16 & 17 September at specific times listed below.  But please note that spaces are extremely limited and tour places will be allocated on a first come, first served basis. Please arrive early to avoid disappointment.","National Portrait Gallery, St Martin's Place, WC2H 0HE",51.50942,-0.12812,18:00:00,18:45:00,No,
New Beacon Books,https://programme.openhouse.org.uk/listings/12275,Specialist bookshop in African and Caribbean literature since 1966.,"76 Stroud Green Road, Finsbury Park, N4 3EN",51.56836,-0.10995,18:00:00,21:00:00,No,
Nunhead Cemetery,https://programme.openhouse.org.uk/listings/1237,"Magnificent Victorian cemetery with Gothic chapel & restored & ruined lodge. One of London's wildest cemeteries. Part restored with the help of a lottery grant. 52 acres of woodland, with bats, owls, foxes & squirrels. Grade II*  landscape.","Linden Grove, Nunhead, SE15 3LP",51.4651848,-0.05196750000000001,13:00:00,17:00:00,No,
Old Royal Naval College,https://programme.openhouse.org.uk/listings/1310,"Sir Christopher Wren's riverside masterpiece in Greenwich, built as the Royal Hospital for Seamen and begun in 1696.","Old Royal Naval College, Greenwich, SE10 9NN",51.4832059,-0.005915399999999999,10:30:00,16:00:00,No,
Olympic Legacy Masterplan,https://programme.openhouse.org.uk/listings/7789,"London’s 2012 Games provided a catalyst for regeneration in the Lower Lea Valley. Guided by the Legacy Masterplan, thousands of new homes and jobs are now being created, stitching together existing communities across the former floodplain.","1A Honour Lea Ave, E20 1DY",51.547522,-0.014855,11:00:00,13:00:00,Yes,Yes
"One Canada Square, Canary Wharf Group (CWG) Marketing Suite",https://programme.openhouse.org.uk/listings/1171,"One of the most iconic structures dominating London’s skyline, One Canada Square is the third tallest building in the UK. It is Canary Wharf Group's landmark tower which houses Europe’s most influential FinTech scaler, Level39.","Meet: South Lobby, One Canada Square, Canary Wharf, E14 5AB",51.5049489,-0.0195006,10:00:00,15:40:00,Yes,Yes
Open Havelock - guided visit,https://programme.openhouse.org.uk/listings/12098,"Open Havelock is a new community project on the Havelock Estate in Southall. The project transforms empty garages, undercrofts and their adjoining grounds into a flexible community facility situated off Willowbrook Road.","64 Havelock Rd, UB2 4GG",51.50065,-0.3674,10:00:00,15:00:00,Yes,Yes
Our Yard at Clitterhouse Farm,https://programme.openhouse.org.uk/listings/8339,Our Yard at Clitterhouse Farm is a community enterprise working to protect historic Victorian farm outbuildings and transform the site into a vibrant and sustainable community hub. Shortlisted for the Open City Stewardship Awards 2021.,"Clitterhouse Playing Fields, Claremont Rd, NW2 1AP",51.5688198,-0.2158112,10:00:00,17:00:00,No,
Paddington Pantheon,https://programme.openhouse.org.uk/listings/11801,The Paddington Pantheon is a restored and reimagined Mews House within a conservation area in West end London. We were commissioned by two artists to provide a series of gallery spaces within a rejuvenated and expanded family home.,"37 Bathurst Mews, Paddington, W2 2SB",51.5142102,-0.1733885,10:00:00,17:00:00,No,
Painters' Hall,https://programme.openhouse.org.uk/listings/1311,"Acquired in 1532 and rebuilt in 1670 after the Great Fire, the Hall was partially destroyed in 1941 by enemy action and rebuilt in a Neo-Georgian style in 1960. The original charter, portraiture and stained glass are of particular interest.","9 Little Trinity Lane, EC4V 2AD",51.5116609,-0.09499049999999999,10:00:00,16:00:00,No,
"Patch, 42 York Street",https://programme.openhouse.org.uk/listings/11818,"Patch is a pioneering neighbourhood workspace & culture venue in Twickenham.
Housed in a striking Art Deco building, formerly home to the South Eastern Electricity Board, it’s a new local centre for work, cultural & community events.","42 York Street, Twickenham, TW1 3BW",51.4475074,-0.3263997,10:00:00,16:00:00,No,
Peer,https://programme.openhouse.org.uk/listings/11837,"Free access to the final weekend of 'we are a group of people composed of who we are', a survey exhibition that traces artistic, cultural and social collective work that took place in Hackney between 1971 and 1986.","Peer, 97-99 Hoxton Street, N1 6QL",51.5297466,-0.0804599,12:00:00,18:00:00,No,
People's Museum Somers Town,https://programme.openhouse.org.uk/listings/10952,"A great little museum set in the Grade 2 listed Ossulston Estate - a prime example of pre-war Social housing - based on Karl Marz Hof in Vienna.
Open Wednesdays to Saturdays throughout Festival 
Sunday 11th Event","52 Phoenix Road, NW1 1ES",51.5310613,-0.1309568,11:00:00,17:00:00,Yes,Yes
Phoenix Gardens Community Building,https://programme.openhouse.org.uk/listings/6841,"The first purpose-built new-build community centre to be built in the heart of Soho for generations, located within the renowned Phoenix Gardens. Winner: RIBA London Award. Designed by RIBA London Architect of the Year Winner.","21 Stacey Street    , WC2H 8DG",51.5144001,-0.1285292,11:00:00,17:00:00,Yes,Yes
Pope's Grotto,https://programme.openhouse.org.uk/listings/1379,Grotto with mineral decoration is last remaining part of Alexander Pope's villa built 1720. The villa was demolished 1808 and replaced and redeveloped many times in following years but Pope's Grotto remains.,"Radnor House School, Pope's Villa, Cross Deep, Twickenham, TW1 4QG",51.4419712,-0.3314995,10:00:00,12:00:00,Yes,Yes
Poroban studio,https://programme.openhouse.org.uk/listings/11347,"Poroban is a multi-disciplinary design studio, based off Old Kent Road, specialising in low carbon building design. We are offering free design surgeries throughout September and are hosting an open day on Saturday 9th Sept.","43 Madron Street, SE17 2LE",51.48900930000001,-0.0790748,11:00:00,15:00:00,Yes,Yes
Preedy Glass,https://programme.openhouse.org.uk/listings/8230,An industrial building originally built for maintaining railways with a modern rear extension now housing a modern glass processing company,"Stanley Works, 7B Coronation Road, NW10 7PQ",51.5285209,-0.2729878,08:00:00,16:00:00,No,
Present & Correct Stationers,https://programme.openhouse.org.uk/listings/11947,"Architecture for London designed and built a new home for stationers Present & Correct in a heritage retail unit. In a nod to the neighbouring British Museum, cabinets as 'wunderkammer' display the stationery as objects of desire.","12 Bury Place, WC1A 2JL",51.51846,-0.1242,11:00:00,18:00:00,No,
