name,url,description,address,latitude,longitude,start_time,end_time,ticketed_events,fully_booked
1-4 Suffolk Street: Uni of Notre Dame & G.K Chesterton,https://programme.openhouse.org.uk/listings/11735,"Built for the United Universities Club, 1-4 Suffolk Street  is now home to the University of Notre Dame and its G.K Chesterton Collection. Visitors will be able to enjoy both this Edwardian listed building and the unique collection within.","1-4 Suffolk Street, SW1Y 4HG",51.50831849999999,-0.1304929,10:00:00,16:30:00,Yes,Yes
1.20 Oxo Tower Wharf,https://programme.openhouse.org.uk/listings/8766,"Unit 1.20 is one of 25 workshop and retail units in Oxo Tower Wharf and overlooks the courtyard towards the Bargehouse building from the first floor walkway. It is a multi-purpose space used as a workshop, showroom and teaching space.","Unit 1.20, The Courtyard, Oxo Tower Wharf, Bargehouse Street",51.5083463,-0.1082762,13:00:00,17:30:00,No,
10 Tollgate Drive,https://programme.openhouse.org.uk/listings/12261,"Part of Austin Vernon & Parters designed estate completed 1966, 10 Tollgate Drive is range style house, refurbished in 2008 by Powell Tuck Associates,  owners are Angus and Sarah Shepherd, Angus is Director at Powell Tuck Associates.","10 Tollgate Drive, SE21 7LS",51.437,-0.08208,10:00:00,16:30:00,No,
1923 Northern Line Extension stations,https://programme.openhouse.org.uk/listings/11786,"A tour that contrasts the before and after of the architecture of the 1922 Northern line extension, examining the impact on the existing terminus at Golders Green as well as the new station architectural vernacular created by Stanley Heaps","Golders Green Underground Station, North End Road, NW11 7RN",51.5722281,-0.1942171,10:00:00,16:30:00,Yes,Yes
195 Mare Street,https://programme.openhouse.org.uk/listings/11871,195 Mare Street,"195 Mare St, E8 3QE",51.5408349,-0.0554502,11:00:00,18:00:00,No,
25 Cannon Street,https://programme.openhouse.org.uk/listings/11339,"Situated adjacent to St. Paul’s Cathedral, our reworking of this six-storey neo-classical building has created 116,000 sq ft of high-quality office space, three levels of communal terraces and a large new garden designed by Tom Stuart-Smith","25 Cannon Street, EC4M 5TA",51.5130649,-0.0953226,11:00:00,15:00:00,Yes,Yes
"373 Euston Road, Birkbeck College",https://programme.openhouse.org.uk/listings/9543,"The refurbishment and roof extension of 7-storey building at 373 Euston Road to accommodates a 180-person lecture theatre, high-quality classrooms, as well as formal and informal co-learning spaces.","373 Euston Road, NW1 3AR",51.52376779999999,-0.1424736,10:00:00,13:30:00,Yes,Yes
8 Gransden Road,https://programme.openhouse.org.uk/listings/10622,"A basement, rear extension and courtyard garden to an end of terrace Victorian house. The design focusses on natural materials, expression of structure and craftsmanship, with high levels of daylight.","8 Gransden Road, W12 9SA",51.5025553,-0.2466778,10:00:00,16:00:00,No,
"80 Mallard Place, Twickenham",https://programme.openhouse.org.uk/listings/11885,This is a beautiful house in Eric Lyons' last SPAN development from 1982,"80 Mallard Place, Twickenham, TW1 4SR",51.4359876,-0.3291416,11:00:00,18:00:00,No,
82-83 Margaret Street,https://programme.openhouse.org.uk/listings/11838,"82-83 Margaret Street was originally constructed as a convent in 1914, and contains the Grade II listed All Saints Convent Chapel to the rear.","82-83 Margaret Street, W1W 8LH",51.5170083,-0.1385173,13:00:00,17:00:00,No,
8a Belsize Court Garages,https://programme.openhouse.org.uk/listings/5794,"Originally a late 19C coachman's living quarters and stable, this mews house combines an award-winning architect's studio and spacious light-filled maisonette after a 2-phase carbon-reducing retrofit.","8a Belsize Court Garages, NW3 5AJ",51.5500659,-0.1709004,10:30:00,13:30:00,No,
A Ruskinian Walk Through Shared Heritage,https://programme.openhouse.org.uk/listings/4686,"Ruskinian walk from RIBA award-winning Chiswick Business Park, Gunnersbury Triangle Nature Reserve through South Acton Estate, birthplace of artist Patrick Caulfield; Woodlands Park Ice House; to home of Wm Willett, of Daylight Saving Time","Building 3, Chiswick Business Park, 566 Chiswick High Road, W4 5YA",51.4930625,-0.2747704,12:00:00,14:00:00,Yes,Yes
A Tale of Two Cities: North Kensington Walking Tour,https://programme.openhouse.org.uk/listings/11784,"This walking tour maps out North Kensington's evolution from 1800s Victorian middle-class suburbia, to the vibrant and diverse inner London neighbourhood it is today, revealing a multi-faceted, contradictory and oft misunderstood area .","St John's Church, 152 Lansdowne Crescent, W11 2NN",51.51071,-0.20564,11:00:00,14:00:00,Yes,Yes
Abbey Mills Pumping Station,https://programme.openhouse.org.uk/listings/803,"Abbey Mills pumping station 'A', built by engineer Joseph Bazalgette, Edmund Cooper and architect Charles Driver. Built between 1865 and 1868 it is described as the cathedral of sewage.
Follow this link to book: https://bit.ly/abbeymills","Abbey Lane, E15 2RN",51.5322173,-0.0037856,10:00:00,15:50:00,Yes,Yes
Aga Khan Centre,https://programme.openhouse.org.uk/listings/7273,"The Aga Khan Centre, designed by Pritzker prize winning architect Fumihiko Maki, houses the UK institutions of the Aga Khan Development Network. A unique feature are its six gardens inspired by different regions of the Muslim world.","Aga Khan Centre, 10 Handyside Street, N1C 4DN",51.5375703,-0.1248016,10:00:00,17:00:00,Yes,Yes
All Saints Carshalton,https://programme.openhouse.org.uk/listings/3749,"12C south aisle and former chancel. Blomfield nave, chancel, baptistry. Kempe glass, Bodley reredos and screen, spectacular Comper decorations, monuments and brasses, award-winning lighting scheme, fine modern benches.","High Street, Carshalton, SM5 3AG",51.3651363,-0.1616349,10:00:00,16:30:00,No,
"All Saints, Foots Cray",https://programme.openhouse.org.uk/listings/2616,"Medieval church (c1330) amended 1863 by Hakewill and retaining original elements such as windows and an arch to the north aisle, and altar tomb of Sir Simon de Vaughan.","Rectory Lane, Foots Cray, DA14 4QN",51.4246187,0.1090664,10:00:00,16:00:00,No,
Allies and Morrison Open Studio,https://programme.openhouse.org.uk/listings/2223,"Three buildings - one concrete, one Victorian, one timber - have been designed, adapted, restored and extended by Allies and Morrison to create the compact, integrated campus of studio space that the practice calls home.","85 Southwark Street, SE1 0HX",51.5054937,-0.0998399,10:00:00,17:00:00,No,
Ancient Livery Companies in the City of London,https://programme.openhouse.org.uk/listings/10242,"On this walk we shall discover some of the livery companies, learn about their ancient traditions and ceremonies, which are repeated every year. Also hear about  their important role in the City.
Free walks led by City of London Guides","Guildhall Yard, Gresham Street, EC2V 7HH",51.5151073,-0.09212719999999999,10:30:00,15:45:00,No,
Arbeit - Trowbridge Gardens,https://programme.openhouse.org.uk/listings/12041,"On Saturday 9th September, from 12 noon to 5pm, Arbeit will be opening Trowbridge Gardens to the public, with access to gardens and creative workspaces, and a free to attend exhibition and workshops.","Trowbridge Gardens, 1 Trowbridge Road, E9 5LD",51.54439,-0.0286,12:00:00,17:00:00,No,
BT Tower,https://programme.openhouse.org.uk/listings/2735,"An enduring, distinctive feature of the London skyline for the last 54 years, this is a rare opportunity for members of the public to visit the famous revolving floor, 158m above the capital. After the flight the guests can watch a history of the BT Tower film in our auditorium.","45 Maple Street, W1T 4BG",51.5215779,-0.1396211,09:30:00,19:15:00,Yes,Yes
Barking Abbey with St Margaret's Church,https://programme.openhouse.org.uk/listings/3760,"666AD Grade I listed church with a Curfew Tower, Chapel of Holy Rood with 12C Rood Stone amongst monuments, art and ruins. Artworks by George Jack & Walker Organ (1914). Captain Cook was noted to have married here. There is also a tea shop.","The Broadway, North Street, Barking, Essex, IG11 8AS",51.5355556,0.0777778,11:00:00,15:00:00,No,
Beating the Bounds,https://programme.openhouse.org.uk/listings/9208,Setting off from the Festival of Britain site we cover icons of the South Bank before heading into the back streets to see different types of social housing. We travel over to Bankside to see an overview of the historic and contemporary.,"By the London Eye Pier, The Queen's Walk, SE1 7PB",51.5032915,-0.1202671,11:00:00,13:00:00,Yes,Yes
Benjamin Franklin House,https://programme.openhouse.org.uk/listings/2347,"Grade I listed Georgian house, the only surviving home of Benjamin Franklin, retaining many original features including central staircase, lathing, 18th Century panelling, stoves, windows, fittings and beams.","36 Craven Street, WC2N 5NF",51.5076423,-0.1248869,10:00:00,16:00:00,No,
Bethlehem Chapel,https://programme.openhouse.org.uk/listings/8264,"An independent Calvinistic chapel on the east side of Church Terrace in Richmond, London. Built in 1797, the small 1-storey stuccoed building is Grade II* listed. It still has its original galleried interior with pews and pulpit.","Bethlehem Chapel, Church Terrace, Richmond upon Thames , TW10 6SE",51.4590644,-0.3034642,10:00:00,16:00:00,No,
Bethlem Royal Hospital,https://programme.openhouse.org.uk/listings/12129,"Guided walking tours of the grounds of Bethlem Royal Hospital, taking in the Hospital's historic Chapel, its beautiful grounds, Bethlem Museum of the Mind, and Bethlem Gallery. Open House 2023 tours delivered as part of This is Croydon, London Borough of Culture, with the support of Mayor of London and Croydon Council.","Bethlem Museum of the Mind, Beckenham, BR3 3BX",51.38092,-0.02931,10:30:00,12:00:00,Yes,Yes
Billingsgate Roman House & Baths,https://programme.openhouse.org.uk/listings/5296,"Some of London's best Roman remains, comprising late 2C house with a 3C bath house built within its courtyard. First discovered in 1848.","101 Lower Thames Street, EC3R 6DL",51.5092887,-0.08305119999999999,11:00:00,13:45:00,Yes,Yes
Boston Manor House,https://programme.openhouse.org.uk/listings/10142,"Boston Manor House is a Jacobean House built for Lady Mary Reade in 1623 and later owned by the Clitherow family from the 1670s until the 1920s.  The House is now open to the public with free entry six days a week. Its beautifully restored historic interiors, including breath-taking original ornate plasterwork, are joined by two community exhibition galleries, meeting rooms and an attractive modern café","Boston Manor House, Boston Manor Road, Brentford, TW8 9JX",51.49191829999999,-0.3183739,11:00:00,17:00:00,Yes,Yes
Brandon Centre,https://programme.openhouse.org.uk/listings/10233,"West Kentish Town Conservation Area. Brandon Cadbury, (of the famous philanthropic chocolatiers) was so impressed with our founder and young peoples services he donated our building. As a thank you, we named the charity after him in 1984.","26 Prince of Wales Road , Kentish Town, NW5 3LG",51.5467627,-0.1447966,10:00:00,14:00:00,Yes,Yes
Brentford Canal Toll House and Gauging Lock,https://programme.openhouse.org.uk/listings/6146,Single-storey canal toll house (1911) where tolls were collected for passing through the lock. Grand Junction Canal connected the Thames at Brentford to the Industrial Midlands in 1794 at the height of the industrial revolution.,"Grand Union Canal Walk, Brentford, TW8 8GA",51.48297,-0.3119,10:00:00,16:00:00,No,
Brentham Garden Suburb,https://programme.openhouse.org.uk/listings/2571,"Britain's first co-partnership garden suburb, first houses built 1901. Parker and Unwin's plan introduced 1907, mainly Arts and Crafts style; fascinating social history.","The Brentham Club, 38 Meadvale Road, W5 1NP",51.5287856,-0.309085,10:30:00,12:30:00,Yes,Yes
Brixton Windmill,https://programme.openhouse.org.uk/listings/1971,A wonderful reminder of Brixton's rural past and inner London's last working mill. Built in 1816 by the Ashby family who produced flour until 1934.  Restored to working order 2011.,"100 Blenheim Gardens, Windmill Gardens, SW2 5DA",51.45319,-0.1235,13:00:00,17:00:00,Yes,Yes
Bromley Archives- Bromley Central Library,https://programme.openhouse.org.uk/listings/11775,Take a tour around Bromley Archives. The archive store itself is normally closed to the public and visitors will be allowed access within this space and a look at some of the items that we have in our collection.,"Bromley Historic Collections, Bromley Central Library, High Street",51.4036023,0.0147679,11:00:00,16:00:00,Yes,Yes
Bush Theatre - Backstage Tours,https://programme.openhouse.org.uk/listings/11992,"Explore the Bush Theatre, West London’s home of new writing. Get a behind the scenes look at our fifty-year history, including how over 2016 we transformed our 128-year-old building into an accessible and sustainable modern theatre.","Bush Theatre, 7 Uxbridge Rd, W12 8LJ",51.50525,-0.22601,10:00:00,17:00:00,Yes,Yes
Canada House,https://programme.openhouse.org.uk/listings/2783,"Canada's diplomatic home in the United Kingdom, the revitalised Canada House serves as a showcase for the very best of Canadian art and design in the 21C.","Trafalgar Square, SW1Y 5BJ",51.5076923,-0.1287592,10:00:00,16:45:00,Yes,Yes
Carshalton Water Tower and Historic Gardens,https://programme.openhouse.org.uk/listings/3745,"Early 18C Grade II listed building incorporating plunge bath with Delft tiles, orangery, saloon and pump chamber with part-restored water wheel. Hermitage and sham bridge in grounds.","West Street, Carshalton, SM5 2QG",51.3655577,-0.1670357,13:00:00,17:00:00,No,
"Centre Court Shopping Centre, Wimbledon",https://programme.openhouse.org.uk/listings/12151,"Centre Court is in the process of being transformed into a unique mixed-use local community hub. There's a new community-facing entrance, a sliding roof and a range of new uses including a roof-top farm, gym, restaurants, climbing wall etc.","4 Queens Road, Wimbledon, SW19 8YA",51.42174,-0.20355,10:00:00,13:00:00,Yes,Yes
Chartered Accountants' Hall,https://programme.openhouse.org.uk/listings/2842,Late Victorian neo-Baroque building with modern-style 1970 extensions supporting 5 storeys of recently refurbished offices over the Great Hall.,"One Moorgate Place, EC2R 6EA",51.5165568,-0.0884189,09:00:00,14:00:00,No,
Chiswick House and Gardens,https://programme.openhouse.org.uk/listings/2862,"Chiswick House and Gardens is one of the most glorious examples of 18th-century British architecture and landscaping with over 300 years of discovery, inspiration and delight.","Chiswick House and Gardens , Burlington Ln, W4 2RP",51.4838034,-0.258696,11:00:00,15:30:00,Yes,Yes
Christ Church,https://programme.openhouse.org.uk/listings/9134,"The church is designed in the Gothic style, with a semicircular barrel-vaulted ceiling, a highly carved chancel screen and magnificent stained glass windows, notably the large West window, depicting Christ the King enthroned in heaven.","Christchurch Park , Sutton , SM2 5TN",51.3547581,-0.1890652,10:00:00,17:00:00,No,
Church of St Mary the Blessed Virgin,https://programme.openhouse.org.uk/listings/3547,"Founded in 11C, with Jacobean memorial c1615. Burial site of 5 Archbishops of Canterbury.","Addington Village Road, Addington, Croydon, CR0 5AS",51.35844849999999,-0.0310355,10:00:00,16:00:00,No,
City & Guilds of London Art School,https://programme.openhouse.org.uk/listings/10937,,"124 Kennington Park Road, SE11 4DJ",51.48727,-0.10738,10:00:00,17:00:00,No,
City Hall,https://programme.openhouse.org.uk/listings/5318,"The sustainable new headquarters of the Mayor of London and London Assembly located in the Royal Docks, Newham.  The docks are re-emerging as a commercial and cultural hub, and an exciting new waterfront.","Kamal Chunchie Way, E16 1ZE",51.5078589,0.0161094,09:00:00,16:00:00,No,
City Information Centre,https://programme.openhouse.org.uk/listings/4009,London's main tourist information centre is clad in a specially manufactured system of 220 pre-finished stainless steel panels. The subtly reflective surface provides a striking counterpoint to St Paul's.,"St Paul's Churchyard, EC4M 8BX",51.5132944,-0.0989526,09:30:00,17:30:00,No,
City Mill Pool Street,https://programme.openhouse.org.uk/listings/11402,,"City Mill Pool Street, Pool Street, E20 2AF",51.53961,-0.00831,09:00:00,11:00:00,Yes,Yes
City of Westminster Archives Centre,https://programme.openhouse.org.uk/listings/2336,Modern red brick building purpose-built to house the City of Westminster's historic records. Opportunity to visit the conservation studio and see treasures of the archives.,"10 St Ann's Street, SW1P 2DE",51.4974785,-0.1306893,10:00:00,15:00:00,No,
Cressingham Gardens,https://programme.openhouse.org.uk/listings/6047,Low-rise high density estate located next to Brockwell Park. Innovative design with pioneering architectural elements & echoing natural topography. Under threat of demolition by Lambeth council. Tours provided of estate and rotunda.,"Cressingham Gardens Rotunda, Tulse Hill , SW2 2QG",51.4470837,-0.1118877,10:00:00,16:00:00,No,
Croydon Minster,https://programme.openhouse.org.uk/listings/8724,Medieval style church rebuilt by Sir George Gilbert Scott after 1867 fire. Tower & south porch are 15C. Large nave with open timber-work roof leads to chancel dominated by superb stained glass window & rich alabaster reredos.,"Church Street, Croydon, CR0 1RN",51.3738597,-0.1051579,10:30:00,15:00:00,No,
Cycling Book Lovers’ London,https://programme.openhouse.org.uk/listings/11975,"A bicycle tour of public libraries and bookshops from Bloomsbury to the East End celebrating the institutions which keep books circulating and the buildings which bring readers and writers together. Over the course of the tour, we’ll see how architects working across a range of building styles express the ideals of their bookish institutions.",British Library,51.52934,-0.12755,13:30:00,16:30:00,Yes,Yes
Dorich House Museum,https://programme.openhouse.org.uk/listings/271,"The former studio home of the sculptor Dora Gordine and her husband the Hon. Richard Hare, a scholar of Russian art and literature. 1930s house over four floors including a flat roof terrace and views of Richmond Park.","Dorich House Museum, 67 Kingston Vale, SW15 3RN",51.4333564,-0.2630588,11:00:00,17:00:00,No,
Dr Johnson's House,https://programme.openhouse.org.uk/listings/275,"Fine example of an early 5-floor Queen Anne town house with original panelling, open staircase and unique 'swinging panels' on the open-plan first floor. Johnson compiled his famous 'Dictionary of the English Language' (1755)  here.","17 Gough Square, EC4A 3DE",51.5150637,-0.1081791,11:00:00,17:00:00,No,
Ealing South Walk,https://programme.openhouse.org.uk/listings/10295,"This is an attractive walk through Ealing south of Uxbridge Road. It passes Sir John Soane's Pitzhanger Manor, Ealing Studios and many attractive Georgian and early Victorian streets of Ealing's early development.","New Broadway, W5 2XA",51.5130056,-0.306101,11:00:00,13:00:00,Yes,Yes
Eames Fine Art,https://programme.openhouse.org.uk/listings/12193,"A great example of the rich evolution of London’s buildings; from noxious leather treatment warehouse complete with sloping floors, winch poles and loading platforms to a stylish hidden Art Collector’s Studio in the space of 150 years.","54-58 Tanner Street, SE1 3PH",51.49991,-0.07823,11:30:00,17:30:00,No,
East Croydon Community Organisation,https://programme.openhouse.org.uk/listings/10217,"Historic walking tour of East Croydon led by a native. Those who come along are welcome to contribute their memories.  Marvel at one of the oldest electricity sub-stations in Croydon. Tour ends at the iconic One Croydon, the ""Thru'penny Bit"" office block designed by Seifert in the 1960s.  Join us for a drink afterwards in a Victorian hostelry.","The Cricketers, 107 Addiscombe Road, Croydon, CR0 6SG",51.3752,-0.0836,15:00:00,17:00:00,Yes,Yes
East Greenwich Fire Station,https://programme.openhouse.org.uk/listings/12265,A striking 1980s fire station featuring an expressive drill tower.,"East Greenwich Fire Station, 325 Woolwich Road, SE7 7RF",51.48703,0.02229,12:00:00,16:00:00,No,
Eastcote Walking Tour,https://programme.openhouse.org.uk/listings/11816,"Discover the fascinating history of Eastcote and its surroundings, focused on how the landscape has changed, from the exclusively agricultural area to the today's modern suburb, revealing some of the oldest local buildings and their stories","Eastcote Station, Field End Road, Pinner, HA5 1QZ",51.5765526,-0.3971429,10:00:00,17:00:00,Yes,Yes
Edmonton - an Edwardian North London suburb,https://programme.openhouse.org.uk/listings/11952,"Edmonton has been described as a working class suburb but there are now signs of growing affluence, a result of regeneration and some might say the neighbourhood is ripe for gentrification. The walk will explore a variety of neighbourhoods.","Entrance to Silver Street Station (Platform 1, London bound side)",51.61473,-0.06715,10:30:00,13:00:00,Yes,Yes
Emanuel School,https://programme.openhouse.org.uk/listings/332,"Former Royal Patriotic orphanage, converted to school 1883, with 1896 additions and other developments. High Victorian style with stained glass by Moira Forsyth. Set in 12 acres.

In 2022 the building celebrates its 150th anniversary.",Battersea Rise (entrance via bridge over the railway on Spencer Park),51.4570745,-0.1748981,09:30:00,17:00:00,No,
Embassy of the Republic of Poland,https://programme.openhouse.org.uk/listings/7544,"Georgian townhouse built by Robert and James Adam in the years 1776-1780 is a fine example of the Adam style of Neoclassical interior design. Seat of the Polish Embassy in London since 1921, it also houses a collection of Polish artworks.","47 Portland Place, W1B 1JH",51.5208181,-0.145565,11:00:00,15:00:00,Yes,Yes
Exploring Spring Grove Isleworth,https://programme.openhouse.org.uk/listings/9032,"Centred on Spring Grove House, once Sir Joseph Banks home the 1850s vision was for John Taylor Jnr designed grand villas.  Today's  wider architecture includes a former college by John Norton & P Massey plus quirky arts & crafts properties.","Forecourt, Isleworth Railway Station, London Road, Isleworth, TW7 4BX",51.47476,-0.33689,14:00:00,16:00:00,Yes,Yes
Ferry Lane Estate,https://programme.openhouse.org.uk/listings/7547,"A tour round the estate, with visits to residents' homes, information on the original design principles, tenancy types & history plus an opportunity to appreciate the setting with the River Lea bordering the estate. Approx 90 mins.","Nearest property 1 Reedham Close, Ferry Lane Estate, N17 9PX",51.58515,-0.05798,11:00:00,13:00:00,No,
Founders' Hall,https://programme.openhouse.org.uk/listings/8396,"Begun in 1985, our fifth Hall is constructed of traditional materials in a manner which is in keeping with this historic part of the City.","Founders' Hall, 1 Cloth Fair, EC1A 7JQ",51.5192561,-0.0990206,10:00:00,18:00:00,No,
Frederick W Paine Funeral Directors,https://programme.openhouse.org.uk/listings/6971,The town's oldest firm of funeral directors has conducted funerals from these premises since 1908. The original interior is Grade II listed. The building also contains the Frederick W Paine Museum and the firm's archive.,"24 Old London Road, Kingston upon Thames, KT2 6QG",51.4106864,-0.3000781,10:00:00,16:00:00,No,
Freemasons' Hall,https://programme.openhouse.org.uk/listings/436,"The current building, the third on the site, was built between 1927-1933 in the Art Deco style, as a memorial to the 3,225 Freemasons who died in World War I. It is a Grade II* listed building, both internally and externally.","Freemasons' Hall, 60 Great Queen Street, WC2B 5AZ",51.5152355,-0.1211194,10:00:00,17:00:00,No,
From Forest to Morris: A walk around Walthamstow,https://programme.openhouse.org.uk/listings/11296,"A walk around historic Walthamstow showing how this unique area grew from a village into a thriving suburb, its social history and the variety of buildings that can be found where Epping Forest meets William Morris.",Outside Costa Coffee at Walthamstow Central Station 5 Station Approac,51.5828202,-0.0194102,11:00:00,13:00:00,Yes,Yes
From Old Oak to White City,https://programme.openhouse.org.uk/listings/11744,"The walk will explore four different types of housing north and south of the A40, which reveal much about the history of social housing in London. It will also include a rare chance to visit an award-winning community garden.","East Acton Tube Station,, Erconwald Street, W12 0BP",51.51661,-0.24746,10:30:00,13:00:00,Yes,Yes
Fulham Road Picturehouse,https://programme.openhouse.org.uk/listings/11761,Fulham Road Picturehouse takes us back to the glory days of 1930s period glamour in this stunning listed building. Earle Architects (who did a fantastic job with Bromley Picturehouse) have helped us revive Fulham Road to its former vintage,"Fulham Road Picturehouse, 142 Fulham Road, SW10 9QR",51.4871141,-0.1793828,10:30:00,11:30:00,Yes,Yes
GOSH Sight and Sound Hospital & St Christophers Chapel,https://programme.openhouse.org.uk/listings/11828,"Visitors will be led on a tour of GOSH's newest redevelopment site, the Sight and Sound Hospital featuring a sensory garden and bespoke artworks. Tours will continue to the beautiful and unexpected St Christopher's chapel in the main site.","GOSH Sight and Sound Hospital, 40-41 Queen Square, WC1N 3AJ",51.5210526,-0.121682,11:00:00,16:45:00,Yes,Yes
