name,url,description,address,latitude,longitude,start_time,end_time,ticketed_events,fully_booked
"""Chinese"" Garage",https://programme.openhouse.org.uk/listings/11337,A Grade II listed motor garage and petrol station built in the style of a Japanese pagoda in 1928. Now a Tesco Express.,"Chinese Garage, Stone Park Avenue, BR3 3FE",51.3988696,-0.0188405,07:00:00,23:00:00,No,
Altab Ali Park,https://programme.openhouse.org.uk/listings/11340,"Altab Ali Park was renamed in 1998 after a murdered 25-year-old Bangladeshi Sylheti clothing worker. Formerly known as St. Mary's Park, it is the site of the old 14 C white church, St. Mary Matfelon which gave Whitechapel its name.","Alder Street,, E1 1FD",51.51538,-0.0672139,07:00:00,23:00:00,No,
Hyde Park Chapel,https://programme.openhouse.org.uk/listings/9987,The four-story Church façade and prominent seven-story tower is covered in Portland stone and highlighted by a golden steeple. The interior features the Christus statue and a large mural of the resurrected Jesus Christ.,"64-68 Princes Gate, Exhibition Road, SW7 2PA",51.497811,-0.1734449,10:00:00,20:00:00,No,
New Ground (online only),https://programme.openhouse.org.uk/listings/30,"25 homes designed with the Older Women’s Co-Housing group using PTE’s ‘fabric first’ approach which maximises the benefits of orientation, air-tightness, insulation and following the co-housing model. www.youtube.com/watch?v=9q25nbEl8rg","5b Union Street, Chipping Barnet, Barnet",51.6542151,-0.202757,07:00:00,23:00:00,Yes,No
Pushkin House,https://programme.openhouse.org.uk/listings/4108,The independent cultural centre Pushkin House will contribute to this year's Open House Festival through a programme of events and community initiatives at its Grade-II listed building in Bloomsbury Square.,"5a Bloomsbury Square, WC1A 2TA",51.5182912,-0.1230772,09:00:00,21:00:00,No,
